{
  "model": "meta-llama/Llama-3.1-8B-Instruct",
  "certified": false,
  "threshold_d": 3.0,
  "formula": "d_COMM = -log(E[4c*sqrt(1-c^2)] / 2), certified if d >= threshold",
  "layers": {
    "weight_quant": {
      "d_comm": 0.0001,
      "divergence_bound": 1.999835,
      "certified": false,
      "budget": 3.0,
      "n_samples": 250,
      "n_domains": 5,
      "worst_domain": "code",
      "per_domain": {
        "math": 0.0104,
        "multilingual": 0.0098,
        "chat": 0.0125,
        "code": 0.0001,
        "general": 0.0222
      },
      "statistic": "min d_comm over domains (worst-domain, not average)",
      "n_prompts": 250,
      "cos_sim_min": -0.04640827257355093,
      "cos_sim_mean": 0.6377737086879391
    }
  },
  "metadata": {
    "hostname": "6f073a981420",
    "platform": "Linux-6.8.0-90-generic-x86_64-with-glibc2.35",
    "python": "3.11.10",
    "timestamp_utc": "2026-07-06T08:40:06Z",
    "torch": "2.11.0+cu130",
    "gpu": "NVIDIA H100 80GB HBM3",
    "gpu_memory_bytes": 85017493504,
    "cuda": "13.0",
    "vllm": "0.24.0",
    "transformers": "5.13.0",
    "deltacert_version": "1.0.5"
  },
  "theorem": "Proposition 5.1, Shorya 2026",
  "description": "",
  "validation_status": "flagship_validated",
  "signature": {
    "alg": "Ed25519",
    "key_id": "threvo-labs-v1",
    "value": "kdSkq7IgZRZhK0KKqJuz0HuMr2R7ISN1i2xnuEwNl302OnLEN070hAUysN2onte8xr0kIAcLXhcQ1g76ZSnjCw=="
  }
}